{
 "$schema":"../schemas/workflow-catalog.schema.json",
 "kind":"workflow-catalog",
 "version":"2.1.0",
 "updated":"2026-08-05",
 "status":"workflow-governance-sidecar",
 "execution_contract":{"executor":"human-or-agent","automatic_execution":false,"default_working_directory":".","variable_syntax":"${inputs.<name>}","result_states":["PASS","WARN","FAIL","BLOCKED","EXTERNAL_REQUIRED"],"notes":"本文件是声明式 workflow catalog，不是自动执行引擎；执行器必须按节点顺序采集证据并显式处理失败、回滚与外部平台交接。"},
 "authority":["AGENTS.md",".claude/RULES.md",".claude/BUILD_GUIDE.md",".codex/project-map.json"],
 "global_rules":["先取证再修改；失败时保留首个错误、命令输出和产物状态。","tracked_required 的 repo_script 必须在仓库存在且不是 Git LFS pointer。","runtime_workspace_local、generated_may_be_absent 与 external_platform 不得伪装为可直接执行的仓库命令。","Windows 构建固定使用项目声明的旧工具链并保持文件原编码与换行。","生成代码修复必须回到源定义和生成入口，ABI 敏感变更按整链重编。"],
 "workflows":[
  {
   "id":"win32-build",
   "version":"2.0.0",
   "domain":"platform-build",
   "status":"active",
   "execution_mode":"assisted",
   "summary":"固定 VS2013/v120/Windows SDK 8.1 的 Win32 canonical 构建与产物校验。",
   "triggers":{"priority":95,"keywords":["Win32","VS2013","v120","FireClient.lib","MT3.exe"],"negative_keywords":["Android","iOS","Java server"],"path_globs":["client/MT3Win32App/**","client/FireClient/**","tools/scripts/Build-MT3-Exe-Canonical.ps1"]},
   "routing":{"primary_agent":"mt3_build_expert","supporting_agents":["mt3_test_engineer"],"required_skills":["windows-v120-build"],"optional_runtime_skills":["windows-build-encoding-guard"]},
   "inputs":{"configuration":{"type":"string","description":"构建配置。","required":false,"sensitive":false,"default":"Debug","enum":["Debug","Release"]},"platform":{"type":"string","description":"VS 平台。","required":false,"sensitive":false,"default":"Win32","enum":["Win32"]},"engine_profile":{"type":"string","description":"Win32 引擎配置。","required":false,"sensitive":false,"default":"Upgrade30","enum":["Upgrade30","Legacy226"]}},
   "entry_node":"environment_probe",
   "nodes":{
    "environment_probe":{"kind":"command","summary":"按 EngineProfile 验证 VS2013、v120 与 SDK 8.1 环境。","mutates_workspace":false,"evidence":[{"type":"command-output","source":"验证 VS2013、v120 与 SDK 8.1 环境。","required":true}],"rollback":{"mode":"not_required","instructions":"本节点不修改工作区，无需回滚。"},"on_success":"toolset_gate","on_failure":"blocked","command":{"runner":"powershell","entry_kind":"repo_script","entry":".agents/skills/windows-v120-build/scripts/verify-build-env.ps1","arguments":["-EngineProfile","${inputs.engine_profile}"],"working_directory":".","availability":"tracked_required"}},
    "toolset_gate":{"kind":"command","summary":"按 EngineProfile 执行 v120 工具集一致性门禁。","mutates_workspace":false,"evidence":[{"type":"command-output","source":"执行 v120 工具集一致性门禁。","required":true}],"rollback":{"mode":"not_required","instructions":"本节点不修改工作区，无需回滚。"},"on_success":"canonical_build","on_failure":"blocked","command":{"runner":"powershell","entry_kind":"repo_script","entry":"tools/scripts/Check-v120Toolset.ps1","arguments":["-EngineProfile","${inputs.engine_profile}"],"working_directory":".","availability":"tracked_required"}},
    "canonical_build":{"kind":"command","summary":"按固定入口重建依赖链并生成 MT3.exe。","mutates_workspace":true,"evidence":[{"type":"command-output","source":"按固定入口重建依赖链并生成 MT3.exe。","required":true}],"rollback":{"mode":"manual","instructions":"删除本次构建产物，保留源码并按首个失败项目重建。"},"on_success":"artifact_gate","on_failure":"diagnose","command":{"runner":"powershell","entry_kind":"repo_script","entry":"tools/scripts/Build-MT3-Exe-Canonical.ps1","arguments":["-Configuration","${inputs.configuration}","-Platform","${inputs.platform}","-EngineProfile","${inputs.engine_profile}"],"working_directory":".","availability":"tracked_required"}},
    "artifact_gate":{"kind":"gate","summary":"核对 FireClient.lib 与 MT3.exe 的配置、时间戳和存在性。","mutates_workspace":false,"evidence":[{"type":"artifact","source":"client/FireClient 与 client/MT3Win32App 的 canonical 输出","required":true}],"rollback":{"mode":"not_required","instructions":"本节点不修改工作区，无需回滚。"},"on_success":"complete","on_failure":"failed"},
    "diagnose":{"kind":"handoff","summary":"将首个编译/链接错误交给 Windows 构建专家定位。","mutates_workspace":false,"evidence":[{"type":"manual-check","source":"将首个编译/链接错误交给 Windows 构建专家定位。","required":true}],"rollback":{"mode":"not_required","instructions":"本节点不修改工作区，无需回滚。"},"on_success":"failed","on_failure":"failed","target_agent":"mt3_build_expert"},
    "complete":{"kind":"terminal","summary":"Win32 canonical 构建与产物校验通过。","result":"PASS"},
    "blocked":{"kind":"terminal","summary":"固定工具链或前置依赖不可用。","result":"BLOCKED"},
    "failed":{"kind":"terminal","summary":"构建、链接或产物门禁失败。","result":"FAIL"}
   },
   "compatibility":{"claude_workflow_ids":["windows-build-workflow"],"legacy_ids":[]}
  },
  {
   "id":"android-build",
   "version":"2.0.0",
   "domain":"platform-build",
   "status":"active",
   "execution_mode":"manual-assisted",
   "summary":"固定 NDK r16 clang + Ant + JDK8，且仅允许已验证 free 渠道的 Android 构建。",
   "triggers":{"priority":95,"keywords":["Android","NDK r16","Ant","JDK8","Locojoy","APK"],"negative_keywords":["Gradle","NDK r25","monthpayment"],"path_globs":["client/android/**","tools/scripts/Build-Android-Locojoy-WithGate.ps1"]},
   "routing":{"primary_agent":"mt3_build_expert","supporting_agents":["mt3_resource_pipeline_expert","mt3_test_engineer"],"required_skills":["android-r10e-build"],"optional_runtime_skills":["platform-bridge","windows-build-encoding-guard"]},
   "inputs":{"channel":{"type":"string","description":"已验证渠道；当前仅 free。","required":false,"sensitive":false,"default":"free","enum":["free"]},"build_type":{"type":"string","description":"Ant 构建类型。","required":false,"sensitive":false,"default":"Release","enum":["Debug","Release"]},"sync_res":{"type":"boolean","description":"是否从已生成 staging 目录同步资源。","required":false,"sensitive":false,"default":false}},
   "entry_node":"environment_probe",
   "nodes":{
    "environment_probe":{"kind":"command","summary":"验证 Android 历史工具链环境。","mutates_workspace":false,"evidence":[{"type":"command-output","source":"验证 Android 历史工具链环境。","required":true}],"rollback":{"mode":"not_required","instructions":"本节点不修改工作区，无需回滚。"},"on_success":"jdk8_gate","on_failure":"blocked","command":{"runner":"powershell","entry_kind":"repo_script","entry":".agents/skills/android-r10e-build/scripts/verify-android-r10e-env.ps1","arguments":[],"working_directory":".","availability":"tracked_required"}},
    "jdk8_gate":{"kind":"command","summary":"执行 JDK8 强制门禁。","mutates_workspace":false,"evidence":[{"type":"command-output","source":"执行 JDK8 强制门禁。","required":true}],"rollback":{"mode":"not_required","instructions":"本节点不修改工作区，无需回滚。"},"on_success":"arm64_gate","on_failure":"blocked","command":{"runner":"powershell","entry_kind":"repo_script","entry":"tools/scripts/Assert-AndroidJdk8Gate.ps1","arguments":[],"working_directory":".","availability":"tracked_required"}},
    "arm64_gate":{"kind":"command","summary":"验证 arm64/NDK r16 clang 迁移约束。","mutates_workspace":false,"evidence":[{"type":"command-output","source":"验证 arm64/NDK r16 clang 迁移约束。","required":true}],"rollback":{"mode":"not_required","instructions":"本节点不修改工作区，无需回滚。"},"on_success":"plan_gate","on_failure":"blocked","command":{"runner":"powershell","entry_kind":"repo_script","entry":"tools/scripts/Assert-AndroidArm64Migration.ps1","arguments":[],"working_directory":".","availability":"tracked_required"}},
    "plan_gate":{"kind":"command","summary":"先运行 canonical PlanOnly，核对将执行的真实构建链。","mutates_workspace":false,"evidence":[{"type":"command-output","source":"先运行 canonical PlanOnly，核对将执行的真实构建链。","required":true}],"rollback":{"mode":"not_required","instructions":"本节点不修改工作区，无需回滚。"},"on_success":"resource_gate","on_failure":"failed","command":{"runner":"powershell","entry_kind":"repo_script","entry":"tools/scripts/Build-Android-Locojoy-WithGate.ps1","arguments":["-Channel","${inputs.channel}","-BuildType","${inputs.build_type}","-PlanOnly"],"working_directory":".","availability":"tracked_required"}},
    "resource_gate":{"kind":"manual","summary":"启用 SyncRes 时确认 client/res_android/res 为当前生成结果；缺失时阻塞而非伪造资源。","mutates_workspace":false,"evidence":[{"type":"path-check","source":"client/res_android/res 与 client/android/LocojoyProject/assets/res","required":true}],"rollback":{"mode":"not_required","instructions":"本节点不修改工作区，无需回滚。"},"on_success":"build_with_sync","on_failure":"blocked","when":{"input":"sync_res","operator":"equals","value":true},"on_skip":"build_without_sync"},
    "build_with_sync":{"kind":"command","summary":"启用 SyncRes 时执行 free 渠道 canonical Android 构建。","mutates_workspace":true,"evidence":[{"type":"command-output","source":"启用 SyncRes 时执行 free 渠道 canonical Android 构建。","required":true}],"rollback":{"mode":"manual","instructions":"删除本次 APK/obj/libs 与同步生成资源，重新从源资源打包。"},"on_success":"artifact_gate","on_failure":"diagnose","command":{"runner":"powershell","entry_kind":"repo_script","entry":"tools/scripts/Build-Android-Locojoy-WithGate.ps1","arguments":["-Channel","${inputs.channel}","-BuildType","${inputs.build_type}","-SyncRes"],"working_directory":".","availability":"tracked_required"}},
    "build_without_sync":{"kind":"command","summary":"不同步资源时执行 free 渠道 canonical Android 构建。","mutates_workspace":true,"evidence":[{"type":"command-output","source":"不同步资源时执行 free 渠道 canonical Android 构建。","required":true}],"rollback":{"mode":"manual","instructions":"删除本次 APK/obj/libs 产物。"},"on_success":"artifact_gate","on_failure":"diagnose","command":{"runner":"powershell","entry_kind":"repo_script","entry":"tools/scripts/Build-Android-Locojoy-WithGate.ps1","arguments":["-Channel","${inputs.channel}","-BuildType","${inputs.build_type}"],"working_directory":".","availability":"tracked_required"}},